Datetime,News Source,News author,News Headline,News Description,News URL,News content
2024-10-10 01:07,The Times of India,Reuters,Asian equities climb as US record high lifts mood,"Shares in Japan, South Korea and Australia climbed while Hong Kong equity futures also rose. An index of US-listed Chinese companies fell in New York trading, following the biggest drop in more than four years for mainland China’s benchmark index on Wednesday.",https://economictimes.indiatimes.com/markets/stocks/news/asian-equities-climb-as-us-record-high-lifts-mood/articleshow/114101000.cms,"Asian equities rose Thursday after US stocks set a fresh high ahead of inflation data that may define Federal Reserve policy easing in the coming months.Shares in Japan, South Korea and Australia cli… [+4146 chars]"
2024-11-01 21:28,CNBC,,"Nvidia to join Dow Jones Industrial Average, replacing Intel",,https://www.cnbc.com/2024/11/01/nvidia-to-join-dow-jones-industrial-average-replacing-intel.html,"Nvidia is replacing Intel on the Dow Jones Industrial Average, a shakeup to the blue-chip index that replaces a flagging semiconductor company with the primary vendor of GPUs for AI. 
Intel shares w… [+1700 chars]"
2024-10-16 14:29,Techtarget.com,Adam Armstrong,"Intel, AMD form x86 group in effort to combat Arm",Intel and AMD are joining forces to retain market share and  create seamless interoperability across hardware and software platforms.,https://www.techtarget.com/searchdatacenter/news/366613916/Intel-AMD-form-x86-group-in-effort-to-combat-Arm,"Intel and AMD formed an x86 advisory group to improve interoperability and stave off future market share loss to Arm processors.
The x86 Ecosystem Advisory Group aims to unite hardware and software … [+5038 chars]"
2024-10-28 14:00,Plos.org,"Lynne M. Z. Lafave, Nadine Van Wyk, Alexis D. Webster, Joyce Hayek, Mark R. Lafave","Validity and reliability of a physical literacy knowledge, attitudes, self-efficacy and behaviors questionnaire for early childhood educators (PLKASB-ECE): An exploratory factor analysis","Background Nurturing physical literacy in young children offers a unique opportunity to address global physical inactivity trend. Early childhood education and care (ECEC) environments, with their extensive reach into this age group, and early childhood educa…",https://journals.plos.org/plosone/article?id=10.1371/journal.pone.0312736,"Abstract
Background
Nurturing physical literacy in young children offers a unique opportunity to address global physical inactivity trend. Early childhood education and care (ECEC) environments, wi… [+62042 chars]"
2024-10-10 16:36,Business Standard,Bloomberg,Google now faces painful reckoning in US after EU as antitrust cases rev up,"Google criticized the Justice Department's initial proposal as ""radical,"" saying it would have ""significant unintended consequences for consumers and businesses",https://www.business-standard.com/world-news/google-now-faces-painful-reckoning-in-us-after-eu-as-antitrust-cases-rev-up-124101001302_1.html,"Google criticized the Justice Department's initial proposal as ""radical,"" saying it would have ""significant unintended consequences for consumers and businesses
google, google logo(Photo: Shuttersto… [+5232 chars]"
2024-10-08 04:05,Business Standard,Capital Market,Barometers edge higher; breadth positive,"At 09:28 IST, the barometer index, the S&P BSE Sensex rose 112.26 points or 0.14% to 81,162.26. The Nifty 50 index added 19.80 points or 0.08% to 24,815.55.",https://www.business-standard.com/markets/capital-market-news/barometers-edge-higher-breadth-positive-124100800174_1.html,"The key equity indices traded with minor gains in early trade. The Nifty traded above the 24,800 level. Media, bank and financial services shares advanced while metal, IT and auto stocks declined.
A… [+3950 chars]"
2024-10-08 08:02,Business Standard,Capital Market,Sensex adds 475 pts; European mkt opens lower,"At 13:30 IST, the barometer index, the S&P BSE Sensex was up 475.79 points or 0.59% to 81,525.79. The Nifty 50 index added 165.70 points or 0.67% to 24,966.35.",https://www.business-standard.com/markets/capital-market-news/sensex-adds-475-pts-european-mkt-opens-lower-124100800522_1.html,"The key equity benchmarks traded with substantial gains in afternoon trade. The Nifty traded above the 24,950 mark after hitting days low of 24,756.80 in morning trade. Barring the Nifty metal index,… [+4388 chars]"
2024-10-11 15:00,Anime News Network,,This Week in Games - The Ninja Engine Alarm Column,"This week is packed with live-action movies, alarm clocks to get you waking up to the soothing sounds of Breath of the Wild, and a brand-new game engine!",https://www.animenewsnetwork.com/this-week-in-games/2024-10-11/the-ninja-engine-alarm-column/.216416,"Welcome back, folks! October is in full swing, bringing with it Inktober, the yearly month-long hashtag where artists try to produce a single-inked drawing every day. One of my favorite artists made … [+20216 chars]"
2024-11-03 23:26,Activistpost.com,Activist Post,A “Lockdown Economy” Without The Lockdowns: 48 Percent Of U.S. Small Businesses Couldn’t Even Pay Their Rent Last Month,"By Michael Snyder When nearly half of all small businesses are struggling so much that they can’t even pay their rent, you have an enormous...
A “Lockdown Economy” Without The Lockdowns: 48 Percent Of U.S. Small Businesses Couldn’t Even Pay Their Rent Last Mo…",https://activistpost.com/2024/11/a-lockdown-economy-without-the-lockdowns-48-percent-of-u-s-small-businesses-couldnt-even-pay-their-rent-last-month.html,"By Michael Snyder
When nearly half of all small businesses are struggling so much that they cant even pay their rent, you have an enormous economic crisis on your hands.  The last time that we witne… [+9027 chars]"
2024-10-27 22:59,Laravel News,Laravel News,Creating a CLI Application With Laravel and Docker,"Laravel provides a robust CLI framework built on top of the popular Symfony Console component, which brings the best features of Laravel to the command line. While Laravel is traditionally used to create web applications, some applications need robust CLI com…",https://laravel-news.com/creating-a-cli-app-with-laravel-and-docker,"Laravel provides a robust CLI framework built on top of the popular Symfony Console component, which brings the best features of Laravel to the command line. While Laravel is traditionally used to cr… [+9697 chars]"
2024-10-16 13:11,[Removed],,[Removed],[Removed],https://removed.com,[Removed]
2024-10-28 23:01,Financial Post,Bloomberg News,The Trump Trade: Why Wall Street Is Betting on a Trump Win,Today on the Big Take podcast: Most major polls show Kamala Harris and Donald Trump in a toss-up. But markets seem convinced Trump will win.,https://financialpost.com/pmn/business-pmn/the-trump-trade-why-wall-street-is-betting-on-a-trump-win,"Today on the Big Take podcast: Most major polls show Kamala Harris and Donald Trump in a toss-up. But markets seem convinced Trump will win.
Author of the article:
Donald Trump during a campaign ev… [+16612 chars]"
2024-10-30 09:24,Financial Post,Bloomberg News,The US Pledged to Rein in China’s Tech Ambitions. It’s Struggling,"On today’s Big Take Asia podcast, how China has made key technological advances despite the US’s effort to curb it.",https://financialpost.com/pmn/business-pmn/the-us-pledged-to-rein-in-chinas-tech-ambitions-its-struggling,"On todays Big Take Asia podcast, how China has made key technological advances despite the USs effort to curb it.
Author of the article:
An employee inspect integrated circuit boards at the Smart P… [+16345 chars]"
2024-10-09 22:56,Investing.com,Investing.com,Thunderbird Entertainment Group Reports Fiscal 2024 Results,Thunderbird Entertainment Group Reports Fiscal 2024 Results,https://www.investing.com/news/press-releases/thunderbird-entertainment-group-reports-fiscal-2024-results-93CH-3656723,"The Company exceeds FY 2024 guidance
30% increase in FY 2024 Adjusted EBITDA to $16.7 million
Targets 20%+ revenue growth in FY 2025
Conference call and webcast tomorrow, October 10, at 11 a.m. PT… [+30625 chars]"
2024-10-23 10:22,Financial Post,Bloomberg News,How China’s BYD Became King of Affordable EVs,"On today’s Big Take Asia podcast, how BYD became a top seller of affordable EVs and whether heavy tariffs from the West could slow it down.",https://financialpost.com/pmn/business-pmn/how-chinas-byd-became-king-of-affordable-evs,"On todays Big Take Asia podcast, how BYD became a top seller of affordable EVs and whether heavy tariffs from the West could slow it down.
Author of the article:
Workers assemble a BYD Co. Dolphin … [+18173 chars]"
2024-10-08 10:31,Business Standard,Capital Market,"Indices snap 6-day losing streak; Nifty settles above 25,000; VIX slides 3.26%","As per provisional closing data, the barometer index, the S&P BSE Sensex rose 584.81 points or 0.72% to 81,634.81. The Nifty 50 index added 217.40 points or 0.88% to 25,013.15.",https://www.business-standard.com/markets/capital-market-news/indices-snap-6-day-losing-streak-nifty-settles-above-25-000-vix-slides-3-26-124100800802_1.html,"The key equity benchmarks ended with substantial gains on Tuesday, snapping its six days losing streak. The Nifty settled above the 25,000 level after hitting the days low of 24,756.80 in morning tra… [+6895 chars]"
2024-10-11 01:16,BusinessLine,Team BL,"Share Market Highlights: Sensex falls 230 points, Nifty slips amid foreign outflows and geopolitical tensions","Sensex, Nifty updates on 11 October 2024: The Sensex fell 230.05 points, or 0.28%, closing at 81,381.36, while the Nifty 50 ended down 34.20 points, or 0.14%, at 24,964.25. The market was weighed down by foreign outflows, concerns over moderating earnings, ge…",https://www.thehindubusinessline.com/markets/stock-market-highlights-11-october-2024/article68742161.ece,"<li></li>
October 11, 2024 15:44Currency market updates: Rupee declines 9 paise to 84.07 (provisional) against US dollar.
<li></li>
October 11, 2024 15:39Stock market live today: DSJ Keep Learning… [+41651 chars]"
2024-11-02 18:30,Richmond.com,"By Nathaniel Meyersohn, CNN",Soda is making a comeback,"Consumers are turning away from pricier Starbucks coffee, McDonald’s Big Mac meals, Doritos, Monster energy drinks and Heineken. But they can’t stop guzzling Coke and Dr Pepper.",https://richmond.com/news/nation-world/business/dirty-soda-coke-zero-dr-pepper-increase-sales/article_cb809408-8ddc-55db-b0a7-33a792e93a64.html,"NEW YORK  Consumers are turning away from pricier Starbucks coffee, McDonalds Big Mac meals, Doritos chips, Monster energy drinks and Heineken beer. But they cant stop guzzling Coke and Dr Pepper.
B… [+16502 chars]"
2024-10-08 12:08,Business Standard,Capital Market,"Markets rally as BJP wins Haryana; Nifty crosses 25,000, metal stocks drag","The domestic equity market bounced back sharply on Tuesday, ending a six-day losing streak. The positive sentiment was driven by the BJP's strong performance in Haryana's state elections, defying exit poll predictions. The Nifty50 surged past the 25,000 mark,…",https://www.business-standard.com/markets/capital-market-news/markets-rally-as-bjp-wins-haryana-nifty-crosses-25-000-metal-stocks-drag-124100800962_1.html,"The domestic equity market bounced back sharply on Tuesday, ending a six-day losing streak. The positive sentiment was driven by the BJP's strong performance in Haryana's state elections, defying exi… [+8260 chars]"
2024-11-02 18:30,Roanoke Times,"By Nathaniel Meyersohn, CNN",Soda is making a comeback,"Consumers are turning away from pricier Starbucks coffee, McDonald’s Big Mac meals, Doritos, Monster energy drinks and Heineken. But they can’t stop guzzling Coke and Dr Pepper.",https://roanoke.com/news/nation-world/business/dirty-soda-coke-zero-dr-pepper-increase-sales/article_ae959088-361e-55f8-89a6-9159e78d63de.html,"NEW YORK  Consumers are turning away from pricier Starbucks coffee, McDonalds Big Mac meals, Doritos chips, Monster energy drinks and Heineken beer. But they cant stop guzzling Coke and Dr Pepper.
B… [+16603 chars]"
2024-10-19 10:33,SiliconANGLE News,Dave Vellante,Dave Vellante’s Breaking Analysis: The complete collection,"Breaking Analysis is a weekly editorial program combining knowledge from SiliconANGLE’s theCUBE with spending data from Enterprise Technology Research. Branded as theCUBE Insights, Powered by ETR, the program is our opportunity to share independent, unfiltere…",https://siliconangle.com/2024/10/19/dave-vellantes-breaking-analysis-complete-collection/,"Breaking Analysis is a weekly editorial program combining knowledge from SiliconANGLEs theCUBE with spending data from Enterprise Technology Research.
Branded as theCUBE Insights, Powered by ETR, th… [+182839 chars]"
