Datetime,News Source,News author,News Headline,News Description,News URL,News content
2024-10-26 08:55,ETF Daily News,MarketBeat News,Hyatt Hotels Co. (NYSE:H) Receives Consensus Recommendation of “Hold” from Analysts,"Shares of Hyatt Hotels Co. (NYSE:H – Get Free Report) have been given a consensus recommendation of “Hold” by the nineteen analysts that are covering the company, MarketBeat Ratings reports. Twelve research analysts have rated the stock with a hold recommenda…",https://www.etfdailynews.com/2024/10/26/hyatt-hotels-co-nyseh-receives-consensus-recommendation-of-hold-from-analysts/,"Shares of Hyatt Hotels Co. (NYSE:H – Get Free Report) have been given a consensus recommendation of “Hold” by the nineteen analysts that are covering the company, MarketBeat Ratings reports. Twelve r… [+5166 chars]"
2024-10-29 09:11,ETF Daily News,MarketBeat News,"PFG Investments LLC Has $738,000 Stock Holdings in Hyatt Hotels Co. (NYSE:H)","PFG Investments LLC boosted its stake in Hyatt Hotels Co. (NYSE:H – Free Report) by 1.5% during the 3rd quarter, Holdings Channel.com reports. The institutional investor owned 4,846 shares of the company’s stock after buying an additional 70 shares during the…",https://www.etfdailynews.com/2024/10/29/pfg-investments-llc-has-738000-stock-holdings-in-hyatt-hotels-co-nyseh/,"PFG Investments LLC boosted its stake in Hyatt Hotels Co. (NYSE:H – Free Report) by 1.5% during the 3rd quarter, Holdings Channel.com reports. The institutional investor owned 4,846 shares of the com… [+5537 chars]"
2024-11-05 04:58,Motley Fool Australia,Bronwyn Allen,3 megatrends accessible via the Vanguard MSCI Index International Shares ETF (VGS),"The ASX VGS makes it easy to invest in several global investment megatrends via a single trade. 
The post 3 megatrends accessible via the Vanguard MSCI Index International Shares ETF (VGS) appeared first on The Motley Fool Australia.",https://www.fool.com.au/2024/11/05/3-megatrends-accessible-via-the-vanguard-msci-index-international-shares-etf-vgs/,"The Vanguard MSCI Index International Shares ETF (ASX: VGS) provides handy exposure to several global investment megatrends in a single trade. 
Three of those megatrends are represented in the excha… [+3352 chars]"
2024-10-10 04:19,Business Standard,Bloomberg,"Amazon adds Apple TV+ to US channels store, offering popular shows","Apple will begin selling TV+ subscriptions through Prime later this month, Mike Hopkins, senior vice president of Amazon Prime Video said",https://www.business-standard.com/world-news/amazon-adds-apple-tv-to-us-channels-store-offering-popular-shows-124101000193_1.html,"Apple will begin selling TV+ subscriptions through Prime later this month, Mike Hopkins, senior vice president of Amazon Prime Video said
Apple TV+ was one of the only major streaming services not a… [+2536 chars]"
2024-10-09 22:52,Financial Post,Business Wire,Thunderbird Entertainment Group Reports Fiscal 2024 Results,"The Company exceeds FY 2024 guidance 30% increase in FY 2024 Adjusted EBITDA to $16.7 million Targets 20%+ revenue growth in FY 2025 Conference call and webcast tomorrow, October 10, at 11 a.m. PT/ 2 p.m. ET VANCOUVER, British Columbia — Thunderbird Entertain…",https://financialpost.com/pmn/business-wire-news-releases-pmn/thunderbird-entertainment-group-reports-fiscal-2024-results,"Author of the article:
Article content
The Company exceeds FY 2024 guidance
30% increase in FY 2024 Adjusted EBITDA to $16.7 million
Targets 20%+ revenue growth in FY 2025
Conference call and we… [+33630 chars]"
2024-10-09 11:06,Gadgets360.com,"Leah Nylen, Bloomberg News",US Weighs Google Breakup as Remedy in Historic Antitrust Case,"The US DOJ is weighing a breakup to mitigate the Alphabet business’s dominance in search, the agency said in a court filing on Tuesday. Judge Amit Mehta could also order Google to provide access to the underlying data it uses to build its search results and a…",https://www.gadgets360.com/internet/news/us-google-breakup-remedy-antitrust-case-6751919,"The US Justice Department is considering asking a federal judge to force Google to sell off parts of its business in what would be a historic breakup of one of the world's biggest tech companies. 
A… [+5134 chars]"
2024-10-31 09:00,Gadgets360.com,"Yoolim Lee, Bloomberg",Samsung Rises After Signalling Progress With Nvidia on AI Memory,Samsung Electronics has announced advancements in delivering its cutting-edge AI memory chips to Nvidia providing a measure of confidence to investors concerned about Samsung potentially lagging behind SK Hynix in the fiercely competitive market. The South Ko…,https://www.gadgets360.com/ai/news/samsung-rises-after-signalling-progress-with-nvidia-on-ai-memory-6914368,"Samsung Electronics Co. declared progress in supplying its most advanced AI memory chips to Nvidia Corp., offering some reassurance to investors who fear the company's falling further behind SK Hynix… [+4903 chars]"
2024-10-07 04:09,Financial Post,Bloomberg News,Rio Tinto Makes Approach for $3.3 Billion Arcadium Lithium,"Rio Tinto Group has made an approach for Arcadium Lithium Plc, the two sides said on Monday, confirming the latest takeover proposal in a sector turning its attention back to growth, as major miners scramble to increase their exposure to energy-transition met…",https://financialpost.com/pmn/business-pmn/rio-tinto-makes-approach-for-3-3-billion-arcadium-lithium,"Rio Tinto Group has made an approach for Arcadium Lithium Plc, the two sides said on Monday, confirming the latest takeover proposal in a sector turning its attention back to growth, as major miners … [+7310 chars]"
2024-10-09 00:54,Investing.com,Investing.com,Zoom's chief accounting officer sells over $330k in stock,Zoom's chief accounting officer sells over $330k in stock,https://www.investing.com/news/insider-trading-news/zooms-chief-accounting-officer-sells-over-330k-in-stock-93CH-3654489,"Zoom Video Communications , Inc. (NASDAQ:ZM) has reported a significant stock transaction involving its Chief Accounting Officer, Shane Crehan, according to a recent SEC filing. The executive sold a … [+5487 chars]"
2024-10-29 15:12,Investing.com,Investing.com,Red Dead Redemption hits PC with new features,Red Dead Redemption hits PC with new features,https://www.investing.com/news/company-news/red-dead-redemption-hits-pc-with-new-features-93CH-3688698,"NEW YORK - Rockstar Games, under the Take-Two (NASDAQ:TTWO) Interactive Software, Inc. (NASDAQ: TTWO) umbrella, has released Red Dead Redemption and its expansion Undead Nightmare for PC. This marks … [+5122 chars]"
2024-10-11 10:01,Investing.com,Investing.com,Morgan Stanley cuts Qorvo stock rating to Equalweight,Morgan Stanley cuts Qorvo stock rating to Equalweight,https://www.investing.com/news/company-news/morgan-stanley-cuts-qorvo-stock-rating-to-equalweight-93CH-3659265,"On Friday, Morgan Stanley adjusted its stance on Qorvo Inc (NASDAQ:QRVO), moving from an Overweight to an Equalweight rating and reducing the price target to $120 from the previous $130. The decision… [+3909 chars]"
2024-10-11 18:20,Decrypt,Murtuza Merchant,MicroStrategy Aims to Be ‘Bitcoin Bank’ With Trillion-Dollar Valuation: Michael Saylor,"With nearly $16 billion worth of Bitcoin in the bank, MicroStrategy's Michael Saylor shares big plans ahead for BTC.",https://decrypt.co/285838/microstrategy-bitcoin-bank-trillion-dollar,"MicroStrategy Inc. is positioning itself to transform how capital is preserved and transferred globally, according to a recent report by Bernstein Researchand the companys outspoken co-founder Michae… [+3042 chars]"
2024-10-23 08:50,ETF Daily News,MarketBeat News,MasTec (NYSE:MTZ) Price Target Increased to $150.00 by Analysts at Citigroup,"MasTec (NYSE:MTZ – Free Report) had its target price lifted by Citigroup from $122.00 to $150.00 in a research report released on Tuesday morning, Benzinga reports. They currently have a buy rating on the construction company’s stock. A number of other equiti…",https://www.etfdailynews.com/2024/10/23/mastec-nysemtz-price-target-increased-to-150-00-by-analysts-at-citigroup/,"MasTec (NYSE:MTZ – Free Report) had its target price lifted by Citigroup from $122.00 to $150.00 in a research report released on Tuesday morning, Benzinga reports. They currently have a buy rating o… [+5602 chars]"
2024-10-10 08:49,ETF Daily News,MarketBeat News,MasTec (NYSE:MTZ) Research Coverage Started at JPMorgan Chase & Co.,"JPMorgan Chase & Co. started coverage on shares of MasTec (NYSE:MTZ – Free Report) in a research report released on Monday, MarketBeat Ratings reports. The firm issued an overweight rating and a $153.00 price target on the construction company’s stock. Other …",https://www.etfdailynews.com/2024/10/10/mastec-nysemtz-research-coverage-started-at-jpmorgan-chase-co/,"JPMorgan Chase &amp; Co. started coverage on shares of MasTec (NYSE:MTZ – Free Report) in a research report released on Monday, MarketBeat Ratings reports. The firm issued an overweight rating and a … [+5594 chars]"
2024-10-09 07:27,Investing.com,Investing.com,"Usiminas stock upgraded, Morgan Stanley sees ""untapped gains"" from BF refurbishment","Usiminas stock upgraded, Morgan Stanley sees ""untapped gains"" from BF refurbishment",https://www.investing.com/news/company-news/usiminas-stock-upgraded-morgan-stanley-sees-untapped-gains-from-bf-refurbishment-93CH-3654649,"On Wednesday, Morgan Stanley made a positive adjustment to its rating on Usiminas (USIM5:BZ) (OTC: OTC:USNZY) stock, shifting from an Equalweight to an Overweight stance. This adjustment comes with a… [+4644 chars]"
2024-10-19 11:47,Financial Post,Bloomberg News,Charting the Global Economy: ECB Lowers Rates as Inflation Wanes,The European Central Bank reduced interest rates for the third time this year as a hastier retreat in inflation allows policymakers to offer support to the region’s stuttering economy.,https://financialpost.com/pmn/business-pmn/charting-the-global-economy-ecb-lowers-rates-as-inflation-wanes,"The European Central Bank reduced interest rates for the third time this year as a hastier retreat in inflation allows policymakers to offer support to the regions stuttering economy.
Author of the … [+7494 chars]"
2024-10-08 15:24,Investopedia,Adam Hayes,Should You Buy Apple Stock Before or After a New iPhone is Released?,Regular iPhone releases are important for AAPL shareholders and the company's future prospects.,https://www.investopedia.com/apple-stock-and-new-iphone-release-8722477,"The launch of the iPhone 16 series in September 2024 once again put Apple Inc. (AAPL) in the spotlight. However, the stock had a muted reaction following slower-than-expected sales of the updated rel… [+6410 chars]"
2024-10-30 07:00,Financial Post,GlobeNewswire,Hivello Partners with PKT to Build its Decentralized Media Network,"LONDON and AMSTERDAM, Oct. 30, 2024 (GLOBE NEWSWIRE) — Hivello, a platform dedicated to aggregating DePIN (Decentralized Physical Infrastructure Networks) projects, and PKT, a decentralized media network, are joining forces to power PKT’s media network of the…",https://financialpost.com/globe-newswire/hivello-partners-with-pkt-to-build-its-decentralized-media-network,"Author of the article:
Hivello x PKTGNW
Article content
LONDON and AMSTERDAM, Oct. 30, 2024 (GLOBE NEWSWIRE) Hivello, a platform dedicated to aggregating DePIN (Decentralized Physical Infrastructu… [+7163 chars]"
2024-10-11 01:51,Financial Post,Bloomberg News,"Pressure Amps Up on Infosys, Wipro to Beat High Expectations Amid India Correction Woes","Infosys Ltd., Wipro Ltd. and HCL Technologies Ltd. are up against high expectations as investors increasingly fret over a potential market correction.",https://financialpost.com/pmn/business-pmn/pressure-amps-up-on-infosys-wipro-to-beat-high-expectations-amid-india-correction-woes,"Infosys Ltd., Wipro Ltd. and HCL Technologies Ltd. are up against high expectations as investors increasingly fret over a potential market correction.
Author of the article:
Signage of Infosys Ltd.… [+7119 chars]"
2024-10-10 10:41,Financial Post,Bloomberg News,Coal Expansion Helps Lure Insurers Back to Producer Whitehaven,"Whitehaven Coal Ltd., one of Australia’s largest coal producers, shelved a planned special purpose vehicle originally intended to provide in-house insurance after finding external insurers willing to take on the risk.",https://financialpost.com/pmn/business-pmn/coal-expansion-helps-lure-insurers-back-to-producer-whitehaven,"Whitehaven Coal Ltd., one of Australias largest coal producers, shelved a planned special purpose vehicle originally intended to provide in-house insurance after finding external insurers willing to … [+7238 chars]"
2024-10-22 13:26,Financial Post,Bloomberg News,ASML Chief Sees US Pushing for More China Chip Restrictions,"ASML Holding NV Chief Executive Officer Christophe Fouquet expects pressure will grow from the US to further restrict sales of semiconductor technology to China, the biggest market for the Dutch producer of chipmaking machines.",https://financialpost.com/pmn/business-pmn/asml-chief-sees-us-pushing-for-more-china-chip-restrictions,"ASML Holding NV Chief Executive Officer Christophe Fouquet expects pressure will grow from the US to further restrict sales of semiconductor technology to China, the biggest market for the Dutch prod… [+7378 chars]"
2024-10-17 06:23,ETF Daily News,MarketBeat News,Head to Head Comparison: Complete Solaria (NASDAQ:CSLR) vs. On Track Innovations (OTCMKTS:OTIVF),"Complete Solaria (NASDAQ:CSLR – Get Free Report) and On Track Innovations (OTCMKTS:OTIVF – Get Free Report) are both small-cap oils/energy companies, but which is the better business? We will compare the two companies based on the strength of their valuation,…",https://www.etfdailynews.com/2024/10/17/head-to-head-comparison-complete-solaria-nasdaqcslr-vs-on-track-innovations-otcmktsotivf/,"Complete Solaria (NASDAQ:CSLR – Get Free Report) and On Track Innovations (OTCMKTS:OTIVF – Get Free Report) are both small-cap oils/energy companies, but which is the better business? We will compare… [+5521 chars]"
2024-10-12 12:08,Financial Post,The Associated Press,Changing OpenAI’s nonprofit structure would raise questions about its future,"NEW YORK (AP) — The artificial intelligence maker OpenAI may face a costly and inconvenient reckoning with its nonprofit origins even as its valuation recently exploded to $157 billion. Nonprofit tax experts have been closely watching OpenAI, the maker of Cha…",https://financialpost.com/pmn/changing-openais-nonprofit-structure-would-raise-questions-about-its-future,"Author of the article:
FILE - OpenAI CEO Sam Altman attends an Apple event announcing new products in Cupertino, Calif., June 10, 2024.Photo by Jeff Chiu /THE ASSOCIATED PRESS
Article content
NEW … [+10613 chars]"
2024-10-18 02:51,Financial Post,Bloomberg News,Japan’s Train Lovers Are Snapping Up Shares in a Beloved Metro,Perks that include free tempura toppings and golf are luring retail investors to the country’s biggest initial public offering since 2018.,https://financialpost.com/pmn/business-pmn/japans-train-lovers-are-snapping-up-shares-in-a-beloved-metro,"Perks that include free tempura toppings and golf are luring retail investors to the countrys biggest initial public offering since 2018.
Author of the article:
Passengers board a train operated by… [+10095 chars]"
2024-10-11 18:29,Financial Post,Financial Times,How a break-up of Google could transform tech,The U.S. Department of Justice's attempt to crack open Google's core search business a seminal moment for the tech industry. Find out more.,https://financialpost.com/financial-times/break-up-google-transform-tech,"The U.S. Department of Justice's proposal to shake up the company is a seminal moment for the industry
Author of the article:
A sign at Google headquarters in Mountain View, Calif. is shown on Oct.… [+14943 chars]"
2024-10-24 02:13,Financial Post,Bloomberg News,Billionaire Sex Saga Is Latest Scandal to Rock Australian CEOs,The alleged sex-for-investment scandal embroiling Australian tech billionaire Richard White is just the latest corporate calamity in a country fast losing its reputation as a tightly-regulated market with strict governance standards.,https://financialpost.com/pmn/business-pmn/billionaire-sex-saga-is-latest-scandal-to-rock-australian-ceos,The alleged sex-for-investment scandal embroiling Australian tech billionaire Richard White is just the latest corporate calamity in a country fast losing its reputation as a tightly-regulated market… [+10013 chars]
2024-10-08 10:50,Financial Post,Business Wire,America Speaks: 81% of Consumers Use Voice Tech Daily or Weekly–Is Your Brand Listening?,"58% of consumers say they would be more likely to try a brand that incorporates voice technology in their customer service VANCOUVER, British Columbia — A new survey from TELUS Digital Experience (TELUS Digital) (NYSE and TSX: TIXT), the company dedicated to …",https://financialpost.com/pmn/business-wire-news-releases-pmn/america-speaks-81-of-consumers-use-voice-tech-daily-or-weekly-is-your-brand-listening,"Author of the article:
Article content
 Sorry, your browser doesn't support embedded videos.
58% of consumers say they would be more likely to try a brand that incorporates voice technology in the… [+10802 chars]"
2024-10-10 14:50,Investing.com,Investing.com,Amazon stock keeps buy rating amid supply chain investments,Amazon stock keeps buy rating amid supply chain investments,https://www.investing.com/news/company-news/amazon-stock-keeps-buy-rating-amid-supply-chain-investments-93CH-3658017,"On Thursday, DA Davidson maintained a Buy rating on Amazon.com (NASDAQ:AMZN) shares, with a price target of $235.00, highlighting the company's ongoing investments in its supply chain. Amazon is repo… [+4296 chars]"
2024-10-11 21:44,Investing.com,Investing.com,Nvidia director Mark Stevens sells over $20 million in company stock,Nvidia director Mark Stevens sells over $20 million in company stock,https://www.investing.com/news/insider-trading-news/nvidia-director-mark-stevens-sells-over-20-million-in-company-stock-93CH-3660654,"In a recent transaction, Nvidia Corp (NASDAQ:NVDA) director Mark A. Stevens has sold a significant portion of his holdings in the company. The sale, which took place on October 9, 2024, involved 155,… [+4396 chars]"
2024-10-09 17:48,Investing.com,Investing.com,ResMed CEO sells over $3.4 million in company stock,ResMed CEO sells over $3.4 million in company stock,https://www.investing.com/news/insider-trading-news/resmed-ceo-sells-over-34-million-in-company-stock-93CH-3656293,"ResMed Inc. (NYSE:RMD) CEO Michael J. Farrell has recently sold shares in the company, generating over $3.4 million. On October 7, 2024, Farrell sold 14,683 shares of ResMed common stock at prices ra… [+4256 chars]"
2024-10-30 00:04,Investing.com,Investing.com,Omnipod ® 5 App for iPhone ® Now Fully Available in the United States,Omnipod ® 5 App for iPhone ® Now Fully Available in the United States,https://www.investing.com/news/press-releases/omnipod--5-app-for-iphone--now-fully-available-in-the-united-states-93CH-3689804,<ul><li>Insulet (NASDAQ:PODD) is the first and only company to offer a tubeless automated insulin delivery (AID) system with full control from a compatible iPhone or Android phone</li><li>Provides mo… [+6019 chars]
2024-11-01 09:04,Washington Monthly,Will Norris,Trump Isn’t Even Pretending He Would Fight Corporate Power,"The former president is shamelessly offering plutocrats like Elon Musk political favors for their support—and no longer promising to take on monopolists. 
The post Trump Isn’t Even Pretending He Would Fight Corporate Power appeared first on Washington Monthly.",http://washingtonmonthly.com/2024/11/01/trump-has-stopped-even-pretending-he-would-fight-corporate-power/,"On the campaign trail in 2016, Donald Trump cast himself as a populist taking on the political and corporate establishment. His criticism of corporate mergers and his promises to protect consumers fr… [+12267 chars]"
2024-10-27 22:57,Financial Post,Bloomberg News,Yen Drops as Japan Election Unnerves Investors: Markets Wrap,The yen fell to its weakest level in almost three months after Japan’s ruling coalition failed to win a majority in parliament at the weekend’s election. Crude fell after Israeli strikes on Iran avoided oil facilities.,https://financialpost.com/pmn/business-pmn/yen-drops-as-japan-election-unnerves-investors-markets-wrap,The yen fell to its weakest level in almost three months after Japans ruling coalition failed to win a majority in parliament at the weekends election. Crude fell after Israeli strikes on Iran avoide… [+8486 chars]
2024-11-05 14:00,Steynonline.com,Mark Steyn,Beyond the Margin of Steal,"Donald J Trump has pulled off the most astonishing political comeback in American history. Yeah, sure, Grover Cleveland - but Cleveland wasn't impeached, sued, indicted, arrested, tried, convicted and shot at. It's not simply that the",https://www.steynonline.com/14745/dispatches-from-the-third-world,"Donald J Trump has pulled off the most astonishing political comeback in American history. Yeah, sure, Grover Cleveland - but Cleveland wasn't impeached, sued, indicted, arrested, tried, convicted an… [+14479 chars]"
2024-10-08 02:57,Business Standard,Capital Market,Indices poised for rebound after 6-day fall,GIFT Nifty:,https://www.business-standard.com/markets/capital-market-news/indices-poised-for-rebound-after-6-day-fall-124100800123_1.html,"GIFT Nifty:
The GIFT Nifty October futures contract is currently up 119 points, indicating a potential relief rally for the Nifty 50 following a period of correction over the past six trading sessio… [+2976 chars]"
2024-10-25 21:51,Stockcharts.com,Jayanthi Gopalakrishnan,Election Season: Keep Calm and Optimize Your Portfolio,"Although earnings season is in full swing, trading volume has been relatively light this week. Perhaps investors are waiting for the stock market to show some direction. It could happen next week, one that's jampacked with earnings and market-moving economic …",https://stockcharts.com/articles/chartwatchers/2024/10/election-season-keep-calm-and-91.html,<ul><li>Tech stocks gained some ground this week after better-than-expected earnings from Tesla.</li><li>US Treasury yields continue to rise.</li><li>Bullish momentum keeps gold prices rising higher.… [+5634 chars]
2024-10-21 20:29,Financial Post,Bloomberg News,Why Hedge Funds Are Betting Against the Green Economy,"Today on the Big Take podcast: Green stocks were all the rage. Now, investor enthusiasm seems to be waning. What happened?",https://financialpost.com/pmn/business-pmn/why-hedge-funds-are-betting-against-the-green-economy,"Today on the Big Take podcast: Green stocks were all the rage. Now, investor enthusiasm seems to be waning. What happened?
Author of the article:
The Altamont Pass wind farm outside Tracy, Californ… [+14628 chars]"
2024-10-21 05:10,Financial Post,Bloomberg News,How Russia’s Spies Hacked the Entire Nation of Georgia,"With an election this week, documents seen by Bloomberg expose the extent of Moscow’s infiltration of the former Soviet state.",https://financialpost.com/pmn/business-pmn/how-russias-spies-hacked-the-entire-nation-of-georgia,"With an election this week, documents seen by Bloomberg expose the extent of Moscows infiltration of the former Soviet state.
Author of the article:
3(v(61dhr5w98vq1z7e4lue4_media_dl_1.pngBloomberg… [+13743 chars]"
2024-11-04 15:49,Cisa.gov,CISA,"Vulnerability Summary for the Week of October 28, 2024","High Vulnerabilities

<table>

<tr>
<th>PrimaryVendor -- Product</th>
<th>Description</th>
<th>Published</th>
<th>CVSS Score</th>
<th>Source Info</th>
<th>Patch Info</th>
</tr>



<tr>
<td>acnoo -- flutter_api </td>
<td>Authentication Bypass Using an Altern…",https://www.cisa.gov/news-events/bulletins/sb24-309,"The CISA Vulnerability Bulletin provides a summary of new vulnerabilities that have been recorded in the past week. In some cases, the vulnerabilities in the bulletin may not yet have assigned CVSS s… [+899 chars]"
2024-10-09 13:24,Financial Post,Bloomberg News,"Against the Odds, London Pubs Have Become the City’s Top Tables","Great, and varied, food and drink offerings make business viable in a way that traditional pubs are not.",https://financialpost.com/pmn/business-pmn/against-the-odds-london-pubs-have-become-the-citys-top-tables,"Great, and varied, food and drink offerings make business viable in a way that traditional pubs are not.
Author of the article:
Article content
(Bloomberg) UK pubs are in a well-documented crisis,… [+11642 chars]"
2024-10-28 09:22,Financial Post,Bloomberg News,Filling in the Blanks on Kamala Harris’ Climate Agenda,"Climate hawks are putting forward plans to accelerate clean technologies and impede fossil fuels, pushing beyond President Biden's legacy.",https://financialpost.com/pmn/business-pmn/filling-in-the-blanks-on-kamala-harris-climate-agenda,"Climate hawks are putting forward plans to accelerate clean technologies and impede fossil fuels, pushing beyond President Biden's legacy.
Author of the article:
uc7wy2axiff0fd12bianff64_media_dl_1… [+12078 chars]"
