Datetime,News Source,News author,News Headline,News Description,News URL,News content
2024-10-10 15:00,GlobeNewswire,Dickey’s Barbecue Restaurants,Celebrate National Pulled Pork Day with Dickey’s Barbecue,World’s largest barbecue brand offering $2.99 Pulled Pork Sandwiches online World’s largest barbecue brand offering $2.99 Pulled Pork Sandwiches online,https://www.globenewswire.com/news-release/2024/10/10/2961478/0/en/Celebrate-National-Pulled-Pork-Day-with-Dickey-s-Barbecue.html,"Dallas, TX, Oct. 10, 2024 (GLOBE NEWSWIRE) -- Celebrate National Pulled Pork Day with Dickeys Barbecue Pit, where pulled pork is a way of life.
On Saturday, October 12th, barbecue lovers across the … [+2840 chars]"
2024-10-22 00:21,New York Post,Fox News,Billy Crystal says sharing one ‘common goal’ led to 54-year marriage to ‘extraordinary’ wife,Crystal opened up about the key qualities and shared goals that have kept his marriage going strong over the years.,https://nypost.com/2024/10/21/entertainment/billy-crystal-says-sharing-one-common-goal-led-to-54-year-marriage-to-extraordinary-wife/,"Billy Crystal revealed the secrets behind his decades-long marriage to wife Janice.
The 76-year-old actor and the 75-year-old producer, who share daughters Jennifer, 51, and Lindsay, 46, have been m… [+7347 chars]"
2024-11-01 21:08,Business Insider,insider@insider.com (Jaures Yip),A satellite services company is up 31% after announcing Apple is taking a stake,"Apple is investing further in infrastructure for its satellite messaging features for iPhones, which enables texting without WiFi or cell service.",https://www.businessinsider.com/apple-invests-globalstar-stock-price-satellite-services-2024-11,"A satellite services company got a boost on Friday following its disclosure that Apple is taking a stake as part of a new investment deal.
Shares of Globalstar Inc. closed up over 31% on the news th… [+1460 chars]"
2024-10-24 14:53,Financial Post,The Associated Press,One Tech Tip: How to prepare your online accounts for when you die,"LONDON (AP) — Most people have accumulated a pile of data _ selfies, emails, videos and more — on their social media and digital accounts over their lifetimes. What happens to it when we die? It’s wise to draft a will spelling out who inherits your physical a…",https://financialpost.com/pmn/one-tech-tip-how-to-prepare-your-online-accounts-for-when-you-die,"Author of the article:
Article content
LONDON (AP) Most people have accumulated a pile of data _ selfies, emails, videos and more on their social media and digital accounts over their lifetimes. Wh… [+7460 chars]"
2024-10-10 15:41,Investing.com,Investing.com,Masimo Corp maintains stock target amid AAPL legal update,Masimo Corp maintains stock target amid AAPL legal update,https://www.investing.com/news/company-news/masimo-corp-maintains-stock-target-amid-aapl-legal-update-93CH-3658147,"On Thursday, Wells Fargo reaffirmed its Overweight rating on shares of Masimo Corp (NASDAQ:MASI) with a steady price target of $160.00. This follows the recent legal developments where a California f… [+3920 chars]"
2024-10-29 10:30,GlobeNewswire,Global Market Insights Inc.,"Compact Pick-Up Trucks Market to exceed $43.7 Bn by 2032, Says Global Market Insights Inc.","Major compact pick-up trucks market participants include Ashok Leyland, Tata Motors, General Motors Company, Dongfeng Motor Corporation, Honda Motor Co., Ltd., China FAW Group Corp., Ltd., Ford Motor Company, Hyundai Motor Corporation, Toyota Motor Corporatio…",https://www.globenewswire.com/news-release/2024/10/29/2970613/0/en/Compact-Pick-Up-Trucks-Market-to-exceed-43-7-Bn-by-2032-Says-Global-Market-Insights-Inc.html,"Selbyville, Delaware, Oct. 29, 2024 (GLOBE NEWSWIRE) -- 
The compact pick-up trucks market valuation is predicted to reach USD 43.7 Billion by 2032, reported in a research report by Global Market In… [+6698 chars]"
2024-10-07 22:53,Financial Post,Bloomberg News,Asian Traders Cautious Ahead of China Reopening: Markets Wrap,"Asian stocks were set for a cautious start after losses in the US, with traders preparing for Chinese markets to reopen following a week-long holiday.",https://financialpost.com/pmn/business-pmn/asian-traders-cautious-ahead-of-china-reopening-markets-wrap,"Asian stocks were set for a cautious start after losses in the US, with traders preparing for Chinese markets to reopen following a week-long holiday.
Author of the article:
9j)}8umtnx1ebd1l3uue{mv… [+10521 chars]"
2024-10-18 09:19,ETF Daily News,MarketBeat News,Contrasting GAN (NASDAQ:GAN) & PodcastOne (NASDAQ:PODC),"PodcastOne (NASDAQ:PODC – Get Free Report) and GAN (NASDAQ:GAN – Get Free Report) are both small-cap computer and technology companies, but which is the superior investment? We will contrast the two companies based on the strength of their risk, earnings, ana…",https://www.etfdailynews.com/2024/10/18/contrasting-gan-nasdaqgan-podcastone-nasdaqpodc/,"PodcastOne (NASDAQ:PODC – Get Free Report) and GAN (NASDAQ:GAN – Get Free Report) are both small-cap computer and technology companies, but which is the superior investment? We will contrast the two … [+4498 chars]"
2024-10-14 23:15,Financial Post,Bloomberg News,Asian Stocks Poised to Track US Gains; Oil Drops: Markets Wrap,"Asian shares are poised to follow the lead of another strong performance on Wall Street, with stocks hitting fresh all-time highs. Oil dropped as concerns eased about Israel attacking Iranian energy facilities.",https://financialpost.com/pmn/business-pmn/asian-stocks-poised-to-track-us-gains-oil-drops-markets-wrap,"Asian shares are poised to follow the lead of another strong performance on Wall Street, with stocks hitting fresh all-time highs. Oil dropped as concerns eased about Israel attacking Iranian energy … [+9728 chars]"
2024-11-04 23:30,Shtfplan.com,Mac Slavo,A “Lockdown Economy” Without The Lockdowns,"When nearly half of all small businesses are struggling so much that they can’t even pay their rent, you have an enormous economic crisis on your hands.  The last time that we witnessed anything like this was during the peak of the COVID pandemic, but here in…",https://www.shtfplan.com/headline-news/a-lockdown-economy-without-the-lockdowns,This article was originally published by Michael Snyder at the Economic Collapse Blog under the title: A Lockdown Economy Without The Lockdowns: 48 Percent Of U.S. Small Businesses Couldnt Even Pay T… [+8917 chars]
2024-10-10 15:54,ETF Daily News,MarketBeat News,Stifel Nicolaus Boosts MasTec (NYSE:MTZ) Price Target to $150.00,"MasTec (NYSE:MTZ – Get Free Report) had its price objective boosted by investment analysts at Stifel Nicolaus from $121.00 to $150.00 in a report issued on Thursday, Benzinga reports. The brokerage presently has a “buy” rating on the construction company’s st…",https://www.etfdailynews.com/2024/10/10/stifel-nicolaus-boosts-mastec-nysemtz-price-target-to-150-00/,"MasTec (NYSE:MTZ – Get Free Report) had its price objective boosted by investment analysts at Stifel Nicolaus from $121.00 to $150.00 in a report issued on Thursday, Benzinga reports. The brokerage p… [+6419 chars]"
2024-10-10 09:40,ETF Daily News,MarketBeat News,MasTec (NYSE:MTZ) PT Raised to $145.00,"MasTec (NYSE:MTZ – Get Free Report) had its target price increased by stock analysts at KeyCorp from $123.00 to $145.00 in a note issued to investors on Tuesday, Benzinga reports. The firm currently has an “overweight” rating on the construction company’s sto…",https://www.etfdailynews.com/2024/10/10/mastec-nysemtz-pt-raised-to-145-00/,"MasTec (NYSE:MTZ – Get Free Report) had its target price increased by stock analysts at KeyCorp from $123.00 to $145.00 in a note issued to investors on Tuesday, Benzinga reports. The firm currently … [+6384 chars]"
2024-10-12 14:23,Financial Post,Bloomberg News,Five Themes for Traders to Watch as Earnings Season Kicks Off,"Earnings season is here, and the US stock market’s furious $9 trillion 2024 rally is facing perhaps its biggest test of the year.",https://financialpost.com/pmn/business-pmn/five-themes-for-traders-to-watch-as-earnings-season-kicks-off-2,"Earnings season is here, and the US stock markets furious $9 trillion 2024 rally is facing perhaps its biggest test of the year.
Author of the article:
4ox()}h3zb3xc6{c4xh]1b2j_media_dl_1.pngCitigr… [+8914 chars]"
2024-10-25 13:07,Financial Post,Financial Times,Tech boom forces U.S. funds to dump shares to avoid tax breach,"Investment funds are forced to sell shares, as the lopsided stock market rally has pushed them up against the strict limits. Read on.",https://financialpost.com/financial-times/tech-boom-us-funds-tax-breach,"Asset managers including Fidelity and T Rowe Price are bumping up against limits on size of large holdings
Author of the article:
The recent market rally has driven the S&amp;P 500 and other indice… [+8035 chars]"
2024-10-11 08:37,Financial Post,The Associated Press,One Tech Tip: Here’s what you need to do before and after your phone is stolen or lost,"LONDON (AP) — Phones hold so much of our digital lives — emails, social media and bank accounts, photos, chat messages and more _ that if they ever get stolen or go missing, it can cause major disruption beyond just the loss of a device. In some places, phone…",https://financialpost.com/pmn/one-tech-tip-heres-what-you-need-to-do-before-and-after-your-phone-is-stolen-or-lost,"Author of the article:
FILE - People look at their phones while waiting to cross an intersection in the rain at the Taikoo Li Sanlitun shopping center in Beijing, July, 30, 2024.Photo by Vincent Thi… [+8590 chars]"
2024-10-09 23:09,Financial Post,Bloomberg News,Asian Stocks to Rally as US Record High Lifts Mood: Markets Wrap,Asian equities were primed to advance on Thursday after US stocks set a fresh high ahead of inflation data that may define Federal Reserve policy easing in the coming months.,https://financialpost.com/pmn/business-pmn/asian-stocks-to-rally-as-us-record-high-lifts-mood-markets-wrap,"Asian equities were primed to advance on Thursday after US stocks set a fresh high ahead of inflation data that may define Federal Reserve policy easing in the coming months.
Author of the article:… [+7801 chars]"
2024-10-28 22:56,Financial Post,Bloomberg News,Asian Stocks Set to Rise With US Election in Focus: Markets Wrap,Most Asian shares were set to follow Wall Street higher as traders prepare for the US election and key economic data that will set the stage for the next Federal Reserve decision. Japan stocks may tread water as traders assess the political outlook.,https://financialpost.com/pmn/business-pmn/asian-stocks-set-to-rise-with-us-election-in-focus-markets-wrap,Most Asian shares were set to follow Wall Street higher as traders prepare for the US election and key economic data that will set the stage for the next Federal Reserve decision. Japan stocks may tr… [+11283 chars]
2024-10-14 18:19,Tom's Hardware UK,Mark Tyson,"Ex-Intel CEO Brian Krzanich gets a new job, igniting a massive backlash — new employer Cerence disables social media comments after blistering criticism","Former Intel CEO Brian Krzanich was recently hired to lead at Cerence Inc., an automotive AI technology company based in Burlington, MA. However, Cerence's celebratory statements concerning its new CEO, shared via social media, have quickly turned sour as com…",https://www.tomshardware.com/tech-industry/ex-intel-ceo-brian-krzanich-gets-a-new-job-igniting-a-massive-backlash-new-employer-cerence-disables-social-media-comments-after-blistering-criticism,"Former Intel CEO Brian Krzanich was recently hired to lead at Cerence Inc., an automotive AI technology company based in Burlington, MA. However, Cerence's celebratory statements about its new CEO, s… [+3192 chars]"
2024-10-15 13:57,Financial Post,Bloomberg News,Goldman traders help fuel firm’s 45% profit jump,Goldman Sachs Group profit soared 45 per cent in the third quarter on a surprise increase in equity-trading revenue. Find out more.,https://financialpost.com/fp-finance/goldman-traders-fuel-firm-jump,"The firms stock traders recorded their best quarter in more than three years
Author of the article:
The Goldman Sachs Group Inc. logo is displayed in the reception area of the One Raffles Link buil… [+7022 chars]"
2024-11-01 08:38,Financial Post,Bloomberg News,Stocks Rise With Payrolls Set to Cap Volatile Week: Markets Wrap,"Stocks rose ahead of Friday’s key US jobs data, at the end of a volatile week in which mixed earnings from tech megacaps had the market on the defensive. Oil gained amid renewed tension in the Middle East.",https://financialpost.com/pmn/business-pmn/stocks-rise-with-payrolls-set-to-cap-volatile-week-markets-wrap,"Stocks rose ahead of Fridays key US jobs data, at the end of a volatile week in which mixed earnings from tech megacaps had the market on the defensive. Oil gained amid renewed tension in the Middle … [+7556 chars]"
2024-10-13 06:25,ETF Daily News,MarketBeat News,Head to Head Survey: hopTo (OTCMKTS:HPTO) vs. Docebo (NASDAQ:DCBO),"hopTo (OTCMKTS:HPTO – Get Free Report) and Docebo (NASDAQ:DCBO – Get Free Report) are both small-cap computer and technology companies, but which is the superior business? We will compare the two businesses based on the strength of their earnings, valuation, …",https://www.etfdailynews.com/2024/10/13/head-to-head-survey-hopto-otcmktshpto-vs-docebo-nasdaqdcbo/,"hopTo (OTCMKTS:HPTO – Get Free Report) and Docebo (NASDAQ:DCBO – Get Free Report) are both small-cap computer and technology companies, but which is the superior business? We will compare the two bus… [+6402 chars]"
2024-10-22 21:36,Financial Post,Business Wire,Real Unveils Real Wallet: Empowering Agents with Exceptional Financial Flexibility,"Unique product offering taps into an agent’s complete earnings picture to provide more financial freedom, while positioning Real at the forefront of merging fintech with real estate TORONTO & NEW YORK — The Real Brokerage Inc. (NASDAQ: REAX), a technology pla…",https://financialpost.com/pmn/business-wire-news-releases-pmn/real-unveils-real-wallet-empowering-agents-with-exceptional-financial-flexibility,"Unique product offering taps into an agents complete earnings picture to provide more financial freedom, while positioning Real at the forefront of merging fintech with real estate
TORONTO &amp; NEW… [+6681 chars]"
2024-10-18 19:23,Financial Post,The Associated Press,Judge delays order in antitrust case requiring Google to open up its app store,SAN FRANCISCO (AP) — A federal judge on Friday delayed an order requiring Google to open up its Android app store to more competition until an appeals court decides whether to block the shake-up because of legal questions surrounding a jury’s verdict that bra…,https://financialpost.com/pmn/judge-delays-order-in-antitrust-case-requiring-google-to-open-up-its-app-store,"Author of the article:
FILE - This Tuesday, July 19, 2016, file photo shows the Google logo at the company's headquarters in Mountain View, Calif.Photo by Marcio Jose Sanchez /THE ASSOCIATED PRESS
… [+6620 chars]"
2024-10-10 13:34,ETF Daily News,MarketBeat News,MasTec (NYSE:MTZ) Price Target Raised to $133.00 at Truist Financial,"MasTec (NYSE:MTZ – Free Report) had its price objective raised by Truist Financial from $112.00 to $133.00 in a research note issued to investors on Wednesday morning, Benzinga reports. The brokerage currently has a hold rating on the construction company’s s…",https://www.etfdailynews.com/2024/10/10/mastec-nysemtz-price-target-raised-to-133-00-at-truist-financial/,"MasTec (NYSE:MTZ – Free Report) had its price objective raised by Truist Financial from $112.00 to $133.00 in a research note issued to investors on Wednesday morning, Benzinga reports. The brokerage… [+5777 chars]"
2024-10-10 12:56,ETF Daily News,MarketBeat News,MasTec (NYSE:MTZ) Price Target Increased to $130.00 by Analysts at The Goldman Sachs Group,"MasTec (NYSE:MTZ – Free Report) had its price objective increased by The Goldman Sachs Group from $115.00 to $130.00 in a report issued on Wednesday, Benzinga reports. They currently have a neutral rating on the construction company’s stock. Several other equ…",https://www.etfdailynews.com/2024/10/10/mastec-nysemtz-price-target-increased-to-130-00-by-analysts-at-the-goldman-sachs-group/,"MasTec (NYSE:MTZ – Free Report) had its price objective increased by The Goldman Sachs Group from $115.00 to $130.00 in a report issued on Wednesday, Benzinga reports. They currently have a neutral r… [+5933 chars]"
2024-10-24 13:18,Food Safety News,News Desk,TreeHouse Foods expands waffle and pancake recall following additional testing,"TreeHouse Foods, Inc. has expanded its frozen waffle recall to include all products manufactured at one facility and still within their shelf-life. The recall is expanded to include frozen toaster waffle, Belgian waffle and pancake products because of potenti…",https://www.foodsafetynews.com/2024/10/treehouse-foods-expands-waffle-and-pancake-recall-following-additional-testing/,"TreeHouse Foods, Inc. has expanded its frozen waffle recall to include all products manufactured at one facility and still within their shelf-life. The recall is expanded to include frozen toaster wa… [+33281 chars]"
2024-10-31 18:14,The Daily Dot,Rebecca Leib,"21 of the best celebrity Halloween costumes, 2024 edition","The stars, they love to dress up, just like the rest of us! Here are 21 of the absolute best celebrity Halloween costumes, artfully pulled off by our favorite A-listers, just in time for the spooky season.


1. Sophie Turner as Trinity from The Matrix


Sophi…",https://www.dailydot.com/memes/best-celebrity-halloween-costumes/,"The stars, they love to dress up, just like the rest of us! Here are 21 of the absolute best celebrity Halloween costumes, artfully pulled off by our favorite A-listers, just in time for the spooky s… [+3458 chars]"
2024-10-27 00:30,The Times of India,ETtech,Bits & Bytes: Meta to face more lawsuits in Japan over fake ads,Meta Platforms is facing potential legal action in Japan due to fraudulent advertisements that falsely used celebrity endorsements to solicit investments.  It is argued that Meta has a responsibility to scrutinize ad content and prevent potentially harmful ad…,https://economictimes.indiatimes.com/tech/technology/bits-bytes-meta-to-face-more-lawsuits-in-japan-over-fake-ads/articleshow/114633410.cms,Meta Platforms will face fresh lawsuits in Japan over advertisements that fraudulently solicited investment funds with fake endorsements from celebrities.Around 30 plaintiffs will seek at least 300 m… [+3024 chars]
2024-10-28 07:03,Financial Post,Business Wire,"Ireland, Home of Halloween","Halloween in Ireland is not like Halloween anywhere else… Why? It’s all about the endurance of traditions that span centuries and connect us with our ancient ancestors. DUBLIN — As the long, dark nights roll in swiftly like the mist that appears on the autumn…",https://financialpost.com/pmn/business-wire-news-releases-pmn/ireland-home-of-halloween,"Author of the article:
Article content
 Sorry, your browser doesn't support embedded videos.
Halloween in Ireland is not like Halloween anywhere else Why? Its all about the endurance of traditions… [+10402 chars]"
2024-11-03 22:48,Theeconomiccollapseblog.com,Michael,A “Lockdown Economy” Without The Lockdowns: 48 Percent Of U.S. Small Businesses Couldn’t Even Pay Their Rent Last Month,"When nearly half of all small businesses are struggling so much that they can’t even pay their rent, you have an enormous economic crisis on your hands.  The last time that we witnessed anything like this was during the peak of the COVID pandemic, but here in…",http://theeconomiccollapseblog.com/a-lockdown-economy-without-the-lockdowns-48-percent-of-u-s-small-businesses-couldnt-even-pay-their-rent-last-month/,"When nearly half of all small businesses are struggling so much that they can’t even pay their rent, you have an enormous economic crisis on your hands.  The last time that we witnessed anything like… [+8743 chars]"
2024-10-09 14:56,Investing.com,Investing.com,Breakout Country Hit Tops Xperi's Lists of Most Listened-To Songs In-Vehicle for Q3 2024,Breakout Country Hit Tops Xperi's Lists of Most Listened-To Songs In-Vehicle for Q3 2024,https://www.investing.com/news/press-releases/breakout-country-hit-tops-xperis-lists-of-most-listenedto-songs-invehicle-for-q3-2024-93CH-3655965,<ul><li>Shaboozey's Bar Song (Tipsy) takes the top spot in U.S. and globally</li><li>Sabrina Carpenter's Espresso continues hot streak in Top Five and #1 in the U.K.</li><li>Post Malone's crossover c… [+7434 chars]
2024-10-15 13:07,Financial Post,Business Wire,Introducing ecobee’s Newest Pro-Exclusive Smart Thermostat: ecobee Smart Thermostat Lite,"Hardwired for reliability and built to last, the ecobee Smart Thermostat Lite is designed with the contractor in mind TORONTO — ecobee, a subsidiary of Generac Power Systems (NYSE: GNRC), today announced the new ecobee Smart Thermostat Lite, available exclusi…",https://financialpost.com/pmn/business-wire-news-releases-pmn/introducing-ecobees-newest-pro-exclusive-smart-thermostat-ecobee-smart-thermostat-lite,"Hardwired for reliability and built to last, the ecobee Smart Thermostat Lite is designed with the contractor in mind
TORONTO ecobee, a subsidiary of Generac Power Systems (NYSE: GNRC), today announ… [+4729 chars]"
2024-10-20 09:27,ETF Daily News,MarketBeat News,Vontobel Holding Ltd. Decreases Stake in Hyatt Hotels Co. (NYSE:H),"Vontobel Holding Ltd. trimmed its holdings in shares of Hyatt Hotels Co. (NYSE:H – Free Report) by 2.2% during the third quarter, according to the company in its most recent Form 13F filing with the Securities & Exchange Commission. The institutional investor…",https://www.etfdailynews.com/2024/10/20/vontobel-holding-ltd-decreases-stake-in-hyatt-hotels-co-nyseh/,"Vontobel Holding Ltd. trimmed its holdings in shares of Hyatt Hotels Co. (NYSE:H – Free Report) by 2.2% during the third quarter, according to the company in its most recent Form 13F filing with the … [+5891 chars]"
2024-10-27 08:47,ETF Daily News,MarketBeat News,Hyatt Hotels Co. (NYSE:H) Shares Purchased by Greenleaf Trust,"Greenleaf Trust grew its holdings in shares of Hyatt Hotels Co. (NYSE:H – Free Report) by 6.6% during the third quarter, according to the company in its most recent Form 13F filing with the Securities and Exchange Commission. The fund owned 1,818 shares of th…",https://www.etfdailynews.com/2024/10/27/hyatt-hotels-co-nyseh-shares-purchased-by-greenleaf-trust/,"Greenleaf Trust grew its holdings in shares of Hyatt Hotels Co. (NYSE:H – Free Report) by 6.6% during the third quarter, according to the company in its most recent Form 13F filing with the Securitie… [+5446 chars]"
2024-10-28 13:49,SiliconANGLE News,Ryan Stevens,On theCUBE Pod: The AI bubble isn’t bursting and IBM’s revenue miss,"It’s been another busy week of events for theCUBE, with full coverage of UiPath Forward and Celosphere 24. The trends emerging out of those events, including around AI production readiness, were big subjects for theCUBE Research industry analysts John Furrier…",https://siliconangle.com/2024/10/28/ai-production-readiness-thecube-analysis-thecubepod/,"Its been another busy week of events for theCUBE, with full coverage of UiPath Forward and Celosphere 24. The trends emerging out of those events, including around AI production readiness, were big s… [+6542 chars]"
2024-10-24 09:24,ETF Daily News,MarketBeat News,Hyatt Hotels (NYSE:H) Price Target Raised to $155.00,"Hyatt Hotels (NYSE:H – Free Report) had its price target boosted by Evercore ISI from $145.00 to $155.00 in a report released on Monday, Benzinga reports. The firm currently has an in-line rating on the stock. H has been the subject of several other research …",https://www.etfdailynews.com/2024/10/24/hyatt-hotels-nyseh-price-target-raised-to-155-00/,"Hyatt Hotels (NYSE:H – Free Report) had its price target boosted by Evercore ISI from $145.00 to $155.00 in a report released on Monday, Benzinga reports. The firm currently has an in-line rating on … [+4927 chars]"
2024-11-03 05:42,ETF Daily News,MarketBeat News,Hyatt Hotels (NYSE:H) Upgraded at Hsbc Global Res,"Hyatt Hotels (NYSE:H – Get Free Report) was upgraded by equities researchers at Hsbc Global Res to a “hold” rating in a report released on Friday, Zacks.com reports. A number of other brokerages have also recently commented on H. Macquarie reduced their price…",https://www.etfdailynews.com/2024/11/03/hyatt-hotels-nyseh-upgraded-at-hsbc-global-res/,"Hyatt Hotels (NYSE:H – Get Free Report) was upgraded by equities researchers at Hsbc Global Res to a “hold” rating in a report released on Friday, Zacks.com reports.
A number of other brokerages hav… [+4997 chars]"
2024-10-16 07:28,ETF Daily News,MarketBeat News,Hyatt Hotels (NYSE:H) PT Raised to $169.00 at Truist Financial,"Hyatt Hotels (NYSE:H – Get Free Report) had its price target increased by equities research analysts at Truist Financial from $164.00 to $169.00 in a research note issued to investors on Monday, Benzinga reports. The firm presently has a “buy” rating on the s…",https://www.etfdailynews.com/2024/10/16/hyatt-hotels-nyseh-pt-raised-to-169-00-at-truist-financial/,"Hyatt Hotels (NYSE:H – Get Free Report) had its price target increased by equities research analysts at Truist Financial from $164.00 to $169.00 in a research note issued to investors on Monday, Benz… [+5309 chars]"
